{"schema":"pubrun-benchmark/5","generated_utc":"2026-07-20T17:41:37.266257+00:00","generated_local":"2026-07-20T13:41:37.266271-04:00","mode":"default","iterations":30,"warmup":1,"passes":3,"baseline_pass":true,"git_commit":"3685a1b","machine":{"host":{"os_name":"Linux","os_version":"6.8.0-136-generic","os_release":"#136-Ubuntu SMP PREEMPT_DYNAMIC Wed Jul  1 21:53:05 UTC 2026","hostname":"<redacted>","capture_state":{"status":"complete"}},"hardware":{"cpu":{"architecture":"x86_64","logical_cores":12,"model":"Intel(R) Core(TM) i7-6800K CPU @ 3.40GHz"},"memory_total_bytes":134985220096,"gpus":[{"vendor":"NVIDIA","model":"NVIDIA GeForce GTX 1070","memory_total_bytes":8589934592,"driver_version":"535.309.01"}],"capture_state":{"status":"complete"}},"python":{"executable":"<redacted>","version":"3.14.6 (main, Jul  8 2026, 13:05:09) [GCC 13.3.0]","implementation":"cpython","prefix":"<redacted>","base_prefix":"<redacted>","virtual_env":"<redacted>","sys_path":["<redacted>","<redacted>","<redacted>","<redacted>","<redacted>","<redacted>","<redacted>","<redacted>","<redacted>"],"capture_state":{"status":"complete"},"environment_kind":"venv","in_venv":true,"sys_path_len":9,"pyenv":false},"pubrun_version":"1.3.1","pubrun_commit":"3685a1b3bf079148f0491a1052ec011940e73c97","python_executable":"<redacted>","platform":"linux","filesystem":{"tmpdir":{"path":"<redacted>","mount_point":"<redacted>","fstype":"ext4","is_network":false,"live":{"status":"complete","elapsed_s":0.0,"total_bytes":502392688640,"free_bytes":208909529088,"avail_bytes":183314153472,"total_inodes":31227904,"free_inodes":29853755,"read_only":false}},"results_dir":{"path":"<redacted>","mount_point":"<redacted>","fstype":"ext4","is_network":false,"live":{"status":"complete","elapsed_s":0.0,"total_bytes":502392688640,"free_bytes":208909529088,"avail_bytes":183314153472,"total_inodes":31227904,"free_inodes":29853755,"read_only":false}},"python_prefix":{"path":"<redacted>","mount_point":"<redacted>","fstype":"ext4","is_network":false,"live":{"status":"complete","elapsed_s":0.0,"total_bytes":502392688640,"free_bytes":208909529088,"avail_bytes":183314153472,"total_inodes":31227904,"free_inodes":29853755,"read_only":false}},"pubrun_install":{"path":"<redacted>","mount_point":"<redacted>","fstype":"ext4","is_network":false,"live":{"status":"complete","elapsed_s":0.0,"total_bytes":502392688640,"free_bytes":208909529088,"avail_bytes":183314153472,"total_inodes":31227904,"free_inodes":29853755,"read_only":false}},"devshm":{"path":"<redacted>","mount_point":"<redacted>","fstype":"tmpfs","is_network":false,"live":{"status":"complete","elapsed_s":0.0,"total_bytes":67492610048,"free_bytes":67492610048,"avail_bytes":67492610048,"total_inodes":16477688,"free_inodes":16477687,"read_only":false}},"capture_state":{"status":"complete"}}},"scenario_defs":{"baseline-noop":{"group":"startup","mode":"baseline","workload":"noop.py","config":{}},"import-auto":{"group":"startup","mode":"auto","workload":"noop.py","config":{"console":{"capture_mode":"off"},"capture":{"resources":{"depth":"off"},"subprocesses":{"enabled":false},"git":{"enabled":false},"hardware":{"depth":"off"},"packages":{"mode":"off"},"signals":{"enabled":false}},"events":{"enabled":false}}},"import-noauto":{"group":"startup","mode":"noauto","workload":"noop.py","config":{}},"import-nopatch":{"group":"startup","mode":"nopatch","workload":"noop.py","config":{"console":{"capture_mode":"off"},"capture":{"resources":{"depth":"off"},"subprocesses":{"enabled":false},"git":{"enabled":false},"hardware":{"depth":"off"},"packages":{"mode":"off"},"signals":{"enabled":false}},"events":{"enabled":false}}},"import-noconsole":{"group":"startup","mode":"noconsole","workload":"noop.py","config":{"console":{"capture_mode":"off"},"capture":{"resources":{"depth":"off"},"subprocesses":{"enabled":false},"git":{"enabled":false},"hardware":{"depth":"off"},"packages":{"mode":"off"},"signals":{"enabled":false}},"events":{"enabled":false}}},"import-minimal":{"group":"startup","mode":"minimal","workload":"noop.py","config":{}},"feature-baseline":{"group":"feature","mode":"baseline","workload":"cpu_burn.py","config":{}},"feature-none":{"group":"feature","mode":"auto","workload":"cpu_burn.py","config":{"console":{"capture_mode":"off"},"capture":{"resources":{"depth":"off"},"subprocesses":{"enabled":false},"git":{"enabled":false},"hardware":{"depth":"off"},"packages":{"mode":"off"},"signals":{"enabled":false}},"events":{"enabled":false}}},"feature-resources-15s":{"group":"feature","mode":"auto","workload":"cpu_burn.py","config":{"console":{"capture_mode":"off"},"capture":{"resources":{"depth":"standard","sample_interval_seconds":15},"subprocesses":{"enabled":false},"git":{"enabled":false},"hardware":{"depth":"off"},"packages":{"mode":"off"},"signals":{"enabled":false}},"events":{"enabled":false}}},"feature-resources-1s":{"group":"feature","mode":"auto","workload":"cpu_burn.py","config":{"console":{"capture_mode":"off"},"capture":{"resources":{"depth":"standard","sample_interval_seconds":1},"subprocesses":{"enabled":false},"git":{"enabled":false},"hardware":{"depth":"off"},"packages":{"mode":"off"},"signals":{"enabled":false}},"events":{"enabled":false}}},"feature-resources-tree":{"group":"feature","mode":"auto","workload":"cpu_burn.py","config":{"console":{"capture_mode":"off"},"capture":{"resources":{"depth":"standard","sample_interval_seconds":1,"scope":"tree"},"subprocesses":{"enabled":false},"git":{"enabled":false},"hardware":{"depth":"off"},"packages":{"mode":"off"},"signals":{"enabled":false}},"events":{"enabled":false}}},"feature-subprocesses":{"group":"feature","mode":"auto","workload":"cpu_burn.py","config":{"console":{"capture_mode":"off"},"capture":{"resources":{"depth":"off"},"subprocesses":{"enabled":true},"git":{"enabled":false},"hardware":{"depth":"off"},"packages":{"mode":"off"},"signals":{"enabled":false}},"events":{"enabled":false}}},"feature-git":{"group":"feature","mode":"auto","workload":"cpu_burn.py","config":{"console":{"capture_mode":"off"},"capture":{"resources":{"depth":"off"},"subprocesses":{"enabled":false},"git":{"enabled":true},"hardware":{"depth":"off"},"packages":{"mode":"off"},"signals":{"enabled":false}},"events":{"enabled":false}}},"feature-hardware":{"group":"feature","mode":"auto","workload":"cpu_burn.py","config":{"console":{"capture_mode":"off"},"capture":{"resources":{"depth":"off"},"subprocesses":{"enabled":false},"git":{"enabled":false},"hardware":{"depth":"basic"},"packages":{"mode":"off"},"signals":{"enabled":false}},"events":{"enabled":false}}},"feature-packages-imported":{"group":"feature","mode":"auto","workload":"cpu_burn.py","config":{"console":{"capture_mode":"off"},"capture":{"resources":{"depth":"off"},"subprocesses":{"enabled":false},"git":{"enabled":false},"hardware":{"depth":"off"},"packages":{"mode":"imported-only"},"signals":{"enabled":false}},"events":{"enabled":false}}},"feature-packages-full":{"group":"feature","mode":"auto","workload":"cpu_burn.py","config":{"console":{"capture_mode":"off"},"capture":{"resources":{"depth":"off"},"subprocesses":{"enabled":false},"git":{"enabled":false},"hardware":{"depth":"off"},"packages":{"mode":"full-environment"},"signals":{"enabled":false}},"events":{"enabled":false}}},"hotpath-open-baseline":{"group":"hotpath","mode":"baseline","workload":"file_read.py","config":{}},"hotpath-open-pubrun":{"group":"hotpath","mode":"auto","workload":"file_read.py","config":{"console":{"capture_mode":"off"},"capture":{"resources":{"depth":"off"},"subprocesses":{"enabled":false},"git":{"enabled":false},"hardware":{"depth":"off"},"packages":{"mode":"off"},"signals":{"enabled":false}},"events":{"enabled":false}}},"hotpath-print-baseline":{"group":"hotpath","mode":"baseline","workload":"print_loop.py","config":{}},"hotpath-print-tee":{"group":"hotpath","mode":"auto","workload":"print_loop.py","config":{"console":{"capture_mode":"standard"},"capture":{"resources":{"depth":"off"},"subprocesses":{"enabled":false},"git":{"enabled":false},"hardware":{"depth":"off"},"packages":{"mode":"off"},"signals":{"enabled":false}},"events":{"enabled":false}}},"io-baseline-devnull":{"group":"io_baseline","mode":"baseline","workload":"io_sink.py","config":{}},"io-baseline-devshm":{"group":"io_baseline","mode":"baseline","workload":"io_sink.py","config":{}},"io-baseline-tmpdir":{"group":"io_baseline","mode":"baseline","workload":"io_sink.py","config":{}}},"pass_results":[{"pass":1,"pass_env":{"system_memory":{"total_bytes":134985220096,"free_bytes":58059534336,"available_bytes":127851053056,"cached_bytes":64959750144},"load_average":{"1min":4.11572265625,"5min":1.89111328125,"15min":1.78759765625},"system_iowait_pct":0.0},"timings":{"baseline-noop":[0.017174,0.016729,0.015861,0.013979,0.016912,0.020413,0.017305,0.017351,0.016464,0.017178,0.019212,0.019654,0.016956,0.019477,0.018119,0.016695,0.018144,0.021534,0.02262,0.017318,0.01732,0.016414,0.017846,0.015598,0.016968,0.019104,0.017606,0.015548,0.015488,0.016859],"import-auto":[0.168889,0.163904,0.185945,0.168338,0.15318,0.176259,0.180387,0.1739,0.174441,0.170482,0.167475,0.170775,0.178794,0.168482,0.171787,0.182794,0.174276,0.16465,0.176246,0.164528,0.17654,0.186224,0.173161,0.18436,0.179946,0.168219,0.174256,0.17623,0.178299,0.17421],"import-noauto":[0.136449,0.13206,0.138622,0.146469,0.125212,0.126509,0.127689,0.120059,0.121663,0.12472,0.127527,0.133723,0.12586,0.123009,0.123442,0.123524,0.117406,0.110601,0.108817,0.117246,0.116094,0.114012,0.107609,0.111611,0.111406,0.108399,0.103542,0.116372,0.10634,0.104328],"import-nopatch":[0.143321,0.143969,0.143424,0.163212,0.154965,0.143194,0.143097,0.144748,0.144515,0.142633,0.150912,0.163836,0.177017,0.161378,0.166643,0.165746,0.155176,0.149324,0.173802,0.174575,0.157282,0.143757,0.150093,0.15099,0.15422,0.149089,0.139276,0.147083,0.144678,0.14746],"import-noconsole":[0.149923,0.138185,0.146277,0.149321,0.138848,0.14644,0.155496,0.155119,0.142016,0.156836,0.152317,0.148937,0.165391,0.171971,0.1558